{
  "schema": "urn:raios:hardware:schema:register-map:v1", "mapVersion": 1, "id": "xhci-1.0-owned-surface",
  "device": {
    "bus": "pci", "identity": { "class": 12, "subclass": 3, "programmingInterface": 48 },
    "bar": { "index": 0, "addressSpace": "mmio" },
    "ownedRegions": [
      { "name": "capability", "base": { "kind": "fixed", "offset": 0 }, "length": 32 },
      { "name": "operational", "base": { "kind": "register-derived", "register": "CAPLENGTH", "mask": 255 }, "length": 1024 },
      { "name": "port", "base": { "kind": "region-relative", "region": "operational", "offset": 1024 }, "length": 16, "stride": 16, "countSource": "HCSPARAMS1.MaxPorts" },
      { "name": "interrupter0", "base": { "kind": "register-derived-plus", "register": "RTSOFF", "mask": 4294967264, "add": 32 }, "length": 32 }
    ]
  },
  "provenance": [{ "id": "raios-xhci", "kind": "raios-source", "path": "seed-kernel/src/usb.rs", "lines": "24-66", "claim": "Owned driver PCI binding, offsets, widths inferred from accessors, and masks; no independent xHCI PDF parsing is claimed." }],
  "constants": [
    { "name": "OP_PORT_BASE", "value": 1024, "kind": "region-offset", "meaning": "Per-port register array offset within the operational region.", "provenance": ["raios-xhci"] },
    { "name": "PORT_REGISTER_STRIDE", "value": 16, "kind": "region-stride", "meaning": "Byte stride between xHCI port-register sets.", "provenance": ["raios-xhci"] },
    { "name": "RUNTIME_IR0", "value": 32, "kind": "region-offset", "meaning": "Interrupter-0 offset within the runtime region.", "provenance": ["raios-xhci"] },
    { "name": "PORTSC_SPEED_SHIFT", "value": 10, "kind": "shift", "meaning": "Shift paired with the PORTSC SPEED mask.", "provenance": ["raios-xhci"] }
  ],
  "registers": [
    { "name": "CAPLENGTH", "region": "capability", "offset": 0, "width": 8, "access": "ro", "semantics": { "status": "source-derived", "description": "Capability-register length, read through a 32-bit access in owned source." }, "provenance": ["raios-xhci"] },
    { "name": "HCSPARAMS1", "region": "capability", "offset": 4, "width": 32, "access": "ro", "semantics": { "status": "source-derived", "description": "Structural parameters 1; fields are decoded inline rather than named constants." }, "provenance": ["raios-xhci"] },
    { "name": "HCSPARAMS2", "region": "capability", "offset": 8, "width": 32, "access": "ro", "semantics": { "status": "source-derived", "description": "Structural parameters 2." }, "provenance": ["raios-xhci"] },
    { "name": "HCCPARAMS1", "region": "capability", "offset": 16, "width": 32, "access": "ro", "semantics": { "status": "source-derived", "description": "Capability parameters 1." }, "provenance": ["raios-xhci"] },
    { "name": "DBOFF", "region": "capability", "offset": 20, "width": 32, "access": "ro", "semantics": { "status": "source-derived", "description": "Doorbell-array offset; owned source clears low two bits." }, "provenance": ["raios-xhci"] },
    { "name": "RTSOFF", "region": "capability", "offset": 24, "width": 32, "access": "ro", "semantics": { "status": "source-derived", "description": "Runtime-register offset; owned source clears low five bits." }, "provenance": ["raios-xhci"] },
    { "name": "USBCMD", "region": "operational", "offset": 0, "width": 32, "access": "rw", "semantics": { "status": "source-derived", "description": "USB command.", "bitfields": [{ "name": "RUN_STOP", "mask": 1, "meaning": "Run/stop." }, { "name": "HOST_CONTROLLER_RESET", "mask": 2, "meaning": "Host-controller reset." }, { "name": "INTERRUPTER_ENABLE", "mask": 4, "meaning": "Global interrupter enable." }] }, "provenance": ["raios-xhci"] },
    { "name": "USBSTS", "region": "operational", "offset": 4, "width": 32, "access": "ro", "semantics": { "status": "source-derived", "description": "USB status.", "bitfields": [{ "name": "HALTED", "mask": 1, "meaning": "Controller halted." }, { "name": "CONTROLLER_NOT_READY", "mask": 2048, "meaning": "Controller not ready." }] }, "provenance": ["raios-xhci"] },
    { "name": "PAGESIZE", "region": "operational", "offset": 8, "width": 32, "access": "ro", "semantics": { "status": "source-derived", "description": "Supported page-size bitmap." }, "provenance": ["raios-xhci"] },
    { "name": "CRCR", "region": "operational", "offset": 24, "width": 64, "access": "rw", "semantics": { "status": "source-derived", "description": "Command-ring control; low cycle bit is ORed by owned source." }, "provenance": ["raios-xhci"] },
    { "name": "DCBAAP", "region": "operational", "offset": 48, "width": 64, "access": "rw", "semantics": { "status": "source-derived", "description": "Device-context base-address array pointer." }, "provenance": ["raios-xhci"] },
    { "name": "CONFIG", "region": "operational", "offset": 56, "width": 32, "access": "rw", "semantics": { "status": "source-derived", "description": "Configure register; owned source writes max slots." }, "provenance": ["raios-xhci"] },
    { "name": "PORTSC", "region": "port", "offset": 0, "width": 32, "access": "mixed", "instances": { "countSource": "HCSPARAMS1.MaxPorts", "stride": 16 }, "semantics": { "status": "source-derived", "description": "Per-port status/control; preserve mask intentionally aliases PP.", "bitfields": [{ "name": "CCS", "mask": 1, "meaning": "Current connect status." }, { "name": "PED", "mask": 2, "meaning": "Port enabled/disabled." }, { "name": "PR", "mask": 16, "meaning": "Port reset." }, { "name": "PP", "mask": 512, "meaning": "Port power.", "overlapGroup": "preserve-policy" }, { "name": "SPEED", "mask": 15360, "meaning": "Four-bit speed field at shift 10." }, { "name": "CHANGE_BITS", "mask": 33423360, "meaning": "Owned-source write-one-to-clear change-bit aggregate." }, { "name": "PRESERVE_MASK", "mask": 234931168, "meaning": "Bits preserved by owned read-modify-write policy; not a hardware field.", "overlapGroup": "preserve-policy" }] }, "provenance": ["raios-xhci"] },
    { "name": "IMAN", "region": "interrupter0", "offset": 0, "width": 32, "access": "rw", "semantics": { "status": "source-derived", "description": "Interrupter management; owned source writes bit 1 without naming it." }, "provenance": ["raios-xhci"] },
    { "name": "IMOD", "region": "interrupter0", "offset": 4, "width": 32, "access": "rw", "semantics": { "status": "source-derived", "description": "Interrupt moderation." }, "provenance": ["raios-xhci"] },
    { "name": "ERSTSZ", "region": "interrupter0", "offset": 8, "width": 32, "access": "rw", "semantics": { "status": "source-derived", "description": "Event-ring segment-table size." }, "provenance": ["raios-xhci"] },
    { "name": "ERSTBA", "region": "interrupter0", "offset": 16, "width": 64, "access": "rw", "semantics": { "status": "source-derived", "description": "Event-ring segment-table base address." }, "provenance": ["raios-xhci"] },
    { "name": "ERDP", "region": "interrupter0", "offset": 24, "width": 64, "access": "rw", "semantics": { "status": "source-derived", "description": "Event-ring dequeue pointer.", "bitfields": [{ "name": "EHB", "mask": 8, "meaning": "Event-handler busy acknowledgement as used by owned source." }] }, "provenance": ["raios-xhci"] }
  ]
}
