{
  "schema": "urn:raios:hardware:schema:register-map:v1", "mapVersion": 1, "id": "marvell-88w8897-pcie-owned-surface",
  "device": { "bus": "pci", "identity": { "vendor": "Marvell", "product": "88W8897 PCIe" }, "bar": { "index": 2, "addressSpace": "mmio", "minimumBytes": 3320 }, "ownedRegions": [{ "name": "register-bar", "base": { "kind": "fixed", "offset": 0 }, "length": 3320 }] },
  "provenance": [
    { "id": "raios-marvell-fw", "kind": "raios-source", "path": "crates/raios-core/src/marvell_wifi_fw.rs", "lines": "8-48", "claim": "Offsets and masks mirrored by raiOS; no public datasheet is claimed." },
    { "id": "raios-marvell-pcie", "kind": "raios-source", "path": "seed-kernel/src/marvell_wifi_pcie.rs", "lines": "28-71", "claim": "Owned BAR binding, shared ring-pointer offsets, event offsets, and ring masks." },
    { "id": "linux-mwifiex-note", "kind": "linux-source", "path": "drivers/net/wireless/marvell/mwifiex/pcie.h", "claim": "Upstream Linux mwifiex is the stated replacement source where no public register datasheet is available; exact revision is not pinned by current raiOS source." }
  ],
  "constants": [
    { "name": "RX_DESC_FLAG_SOP", "value": 1, "kind": "descriptor-mask", "meaning": "Start-of-packet descriptor flag; explicitly not an MMIO register field.", "provenance": ["raios-marvell-pcie"] },
    { "name": "RX_DESC_FLAG_EOP", "value": 2, "kind": "descriptor-mask", "meaning": "End-of-packet descriptor flag; explicitly not an MMIO register field.", "provenance": ["raios-marvell-pcie"] },
    { "name": "EVENT_RING_COUNT", "value": 8, "kind": "ring-parameter", "meaning": "Owned event ring entry count.", "provenance": ["raios-marvell-pcie"] },
    { "name": "EVENT_RING_MASK", "value": 15, "kind": "ring-mask", "meaning": "Owned event ring index mask.", "provenance": ["raios-marvell-pcie"] },
    { "name": "EVENT_BUFFER_SIZE", "value": 2048, "kind": "buffer-parameter", "meaning": "Owned event buffer bytes.", "provenance": ["raios-marvell-pcie"] },
    { "name": "EVENT_HEADER_LEN", "value": 4, "kind": "buffer-parameter", "meaning": "Owned event header bytes.", "provenance": ["raios-marvell-pcie"] }
  ],
  "registers": [
    { "name": "PCIE_RX_RD_PTR", "region": "register-bar", "offset": 3164, "width": 32, "access": "rw", "aliasGroup": "rx-read-tx-write-pointer", "semantics": { "status": "source-derived", "description": "Receive read pointer; shares location with TX write pointer.", "bitfields": [{ "name": "RX_INDEX", "mask": 1023, "meaning": "Receive index." }, { "name": "RX_ROLLOVER", "mask": 1024, "meaning": "Receive rollover." }] }, "provenance": ["raios-marvell-pcie"] },
    { "name": "PCIE_TX_WR_PTR", "region": "register-bar", "offset": 3164, "width": 32, "access": "rw", "aliasGroup": "rx-read-tx-write-pointer", "semantics": { "status": "source-derived", "description": "Transmit write pointer alias.", "bitfields": [{ "name": "TX_INDEX", "mask": 67043328, "meaning": "Transmit index field." }, { "name": "TX_ROLLOVER", "mask": 67108864, "meaning": "Transmit rollover." }] }, "provenance": ["raios-marvell-pcie"] },
    { "name": "PCIE_RX_WR_PTR", "region": "register-bar", "offset": 3212, "width": 32, "access": "ro", "aliasGroup": "rx-write-tx-read-pointer", "semantics": { "status": "source-derived", "description": "Receive write pointer; shares location with TX read pointer." }, "provenance": ["raios-marvell-pcie"] },
    { "name": "PCIE_TX_RD_PTR", "region": "register-bar", "offset": 3212, "width": 32, "access": "ro", "aliasGroup": "rx-write-tx-read-pointer", "semantics": { "status": "source-derived", "description": "Transmit read pointer alias.", "bitfields": [{ "name": "TX_WRAP", "mask": 134152192, "meaning": "Owned-source TX wrap/index aggregate." }] }, "provenance": ["raios-marvell-pcie"] },
    { "name": "CMD_ADDR_LO", "region": "register-bar", "offset": 3088, "width": 32, "access": "rw", "semantics": { "status": "source-derived", "description": "Command DMA address low (SCRATCH_0)." }, "provenance": ["raios-marvell-fw", "linux-mwifiex-note"] },
    { "name": "CMD_ADDR_HI", "region": "register-bar", "offset": 3092, "width": 32, "access": "rw", "semantics": { "status": "source-derived", "description": "Command DMA address high (SCRATCH_1)." }, "provenance": ["raios-marvell-fw", "linux-mwifiex-note"] },
    { "name": "PCIE_CPU_INT_EVENT", "region": "register-bar", "offset": 3096, "width": 32, "access": "wo", "semantics": { "status": "source-derived", "description": "Host-to-device interrupt event.", "bitfields": [{ "name": "DNLD_RDY", "mask": 1, "meaning": "Download ready." }, { "name": "DOOR_BELL", "mask": 2, "meaning": "Command doorbell." }, { "name": "EVENT_DONE", "mask": 32, "meaning": "Event completion." }] }, "provenance": ["raios-marvell-fw", "raios-marvell-pcie"] },
    { "name": "PCIE_CPU_INT_STATUS", "region": "register-bar", "offset": 3100, "width": 32, "access": "ro", "semantics": { "status": "unknown", "description": "CPU interrupt status is sampled; bit layout is not named." }, "provenance": ["raios-marvell-fw"] },
    { "name": "PCIE_HOST_INT_STATUS", "region": "register-bar", "offset": 3120, "width": 32, "access": "w1c", "semantics": { "status": "source-derived", "description": "Host interrupt status.", "bitfields": [{ "name": "DNLD_DONE", "mask": 1, "meaning": "Download done." }, { "name": "UPLD_RDY", "mask": 2, "meaning": "Upload ready." }, { "name": "CMD_DONE", "mask": 4, "meaning": "Command done." }, { "name": "EVENT_RDY", "mask": 8, "meaning": "Event ready." }] }, "provenance": ["raios-marvell-fw"] },
    { "name": "PCIE_HOST_INT_MASK", "region": "register-bar", "offset": 3124, "width": 32, "access": "rw", "semantics": { "status": "source-derived", "description": "Host interrupt mask; polarity not generalized beyond owned writes." }, "provenance": ["raios-marvell-fw", "linux-mwifiex-note"] },
    { "name": "PCIE_HOST_INT_STATUS_MASK", "region": "register-bar", "offset": 3132, "width": 32, "access": "rw", "semantics": { "status": "source-derived", "description": "Polled status-bit mask.", "bitfields": [{ "name": "HOST_INTR_MASK", "mask": 15, "meaning": "Aggregate of four host interrupt bits." }] }, "provenance": ["raios-marvell-fw"] },
    { "name": "CMD_SIZE", "region": "register-bar", "offset": 3136, "width": 32, "access": "rw", "semantics": { "status": "source-derived", "description": "Command/download size." }, "provenance": ["raios-marvell-fw"] },
    { "name": "FW_STATUS", "region": "register-bar", "offset": 3140, "width": 32, "access": "ro", "semantics": { "status": "source-derived", "description": "Firmware status (SCRATCH_3).", "constants": [{ "name": "FIRMWARE_READY_PCIE", "value": 4275878400, "kind": "value", "meaning": "Firmware-ready sentinel." }] }, "provenance": ["raios-marvell-fw"] },
    { "name": "CMDRSP_ADDR_LO", "region": "register-bar", "offset": 3280, "width": 32, "access": "rw", "semantics": { "status": "source-derived", "description": "Command-response DMA address low." }, "provenance": ["raios-marvell-fw"] },
    { "name": "CMDRSP_ADDR_HI", "region": "register-bar", "offset": 3284, "width": 32, "access": "rw", "semantics": { "status": "source-derived", "description": "Command-response DMA address high." }, "provenance": ["raios-marvell-fw"] },
    { "name": "PCIE_EVT_RD_PTR", "region": "register-bar", "offset": 3304, "width": 32, "access": "rw", "semantics": { "status": "source-derived", "description": "Event read pointer.", "bitfields": [{ "name": "EVENT_INDEX", "mask": 15, "meaning": "Event index." }, { "name": "EVENT_ROLLOVER", "mask": 128, "meaning": "Event rollover." }] }, "provenance": ["raios-marvell-pcie"] },
    { "name": "PCIE_EVT_WR_PTR", "region": "register-bar", "offset": 3308, "width": 32, "access": "ro", "semantics": { "status": "source-derived", "description": "Event write pointer." }, "provenance": ["raios-marvell-pcie"] },
    { "name": "DRV_READY", "region": "register-bar", "offset": 3312, "width": 32, "access": "rw", "semantics": { "status": "source-derived", "description": "Driver-ready register; value meanings are not asserted." }, "provenance": ["raios-marvell-fw"] },
    { "name": "FW_DUMP_CTRL", "region": "register-bar", "offset": 3316, "width": 32, "access": "ro", "semantics": { "status": "unknown", "description": "Firmware dump control is sampled; bit semantics are unknown here." }, "provenance": ["raios-marvell-fw"] }
  ]
}
