{
  "schema": "urn:raios:hardware:schema:register-map:v1",
  "mapVersion": 1,
  "id": "intel-e1000-8254x",
  "device": {
    "bus": "pci",
    "identity": { "vendorIds": [32902], "deviceIds": [4110, 4111] },
    "bar": { "index": 0, "addressSpace": "mmio", "minimumBytes": 21768 },
    "ownedRegions": [{ "name": "bar0", "base": { "kind": "fixed", "offset": 0 }, "length": 21768 }]
  },
  "provenance": [{ "id": "raios-e1000", "kind": "raios-source", "path": "seed-kernel/src/e1000.rs", "lines": "14-46", "claim": "Names, offsets, IDs, and masks used by the owned driver; no datasheet provenance is claimed." }],
  "registers": [
    { "name": "CTRL", "region": "bar0", "offset": 0, "width": 32, "access": "rw", "semantics": { "status": "source-derived", "description": "Device control.", "bitfields": [{ "name": "SLU", "mask": 64, "meaning": "Set link up as used by raiOS." }] }, "provenance": ["raios-e1000"] },
    { "name": "STATUS", "region": "bar0", "offset": 8, "width": 32, "access": "ro", "semantics": { "status": "unknown", "description": "Status register is read; individual fields are not named in owned source." }, "provenance": ["raios-e1000"] },
    { "name": "ICR", "region": "bar0", "offset": 192, "width": 32, "access": "rwc", "semantics": { "status": "source-derived", "description": "Interrupt cause is read to clear pending state; bit meanings are not represented in owned source." }, "provenance": ["raios-e1000"] },
    { "name": "IMC", "region": "bar0", "offset": 216, "width": 32, "access": "wo", "semantics": { "status": "source-derived", "description": "Interrupt mask clear; raiOS writes all ones." }, "provenance": ["raios-e1000"] },
    { "name": "RCTL", "region": "bar0", "offset": 256, "width": 32, "access": "rw", "semantics": { "status": "source-derived", "description": "Receive control.", "bitfields": [{ "name": "EN", "mask": 2, "meaning": "Enable receive." }, { "name": "BAM", "mask": 32768, "meaning": "Accept broadcast." }, { "name": "SECRC", "mask": 67108864, "meaning": "Strip Ethernet CRC." }] }, "provenance": ["raios-e1000"] },
    { "name": "TCTL", "region": "bar0", "offset": 1024, "width": 32, "access": "rw", "semantics": { "status": "source-derived", "description": "Transmit control; widths of CT/COLD fields are not asserted by owned source.", "bitfields": [{ "name": "EN", "mask": 2, "meaning": "Enable transmit." }, { "name": "PSP", "mask": 8, "meaning": "Pad short packets." }], "constants": [{ "name": "CT_SHIFT", "value": 4, "kind": "shift", "meaning": "Owned-source shift only; field width unknown here." }, { "name": "COLD_SHIFT", "value": 12, "kind": "shift", "meaning": "Owned-source shift only; field width unknown here." }] }, "provenance": ["raios-e1000"] },
    { "name": "RDBAL", "region": "bar0", "offset": 10240, "width": 32, "access": "rw", "semantics": { "status": "source-derived", "description": "Receive descriptor base low." }, "provenance": ["raios-e1000"] },
    { "name": "RDBAH", "region": "bar0", "offset": 10244, "width": 32, "access": "rw", "semantics": { "status": "source-derived", "description": "Receive descriptor base high." }, "provenance": ["raios-e1000"] },
    { "name": "RDLEN", "region": "bar0", "offset": 10248, "width": 32, "access": "rw", "semantics": { "status": "source-derived", "description": "Receive descriptor ring length." }, "provenance": ["raios-e1000"] },
    { "name": "RDH", "region": "bar0", "offset": 10256, "width": 32, "access": "rw", "semantics": { "status": "source-derived", "description": "Receive descriptor head." }, "provenance": ["raios-e1000"] },
    { "name": "RDT", "region": "bar0", "offset": 10264, "width": 32, "access": "rw", "semantics": { "status": "source-derived", "description": "Receive descriptor tail." }, "provenance": ["raios-e1000"] },
    { "name": "TDBAL", "region": "bar0", "offset": 14336, "width": 32, "access": "rw", "semantics": { "status": "source-derived", "description": "Transmit descriptor base low." }, "provenance": ["raios-e1000"] },
    { "name": "TDBAH", "region": "bar0", "offset": 14340, "width": 32, "access": "rw", "semantics": { "status": "source-derived", "description": "Transmit descriptor base high." }, "provenance": ["raios-e1000"] },
    { "name": "TDLEN", "region": "bar0", "offset": 14344, "width": 32, "access": "rw", "semantics": { "status": "source-derived", "description": "Transmit descriptor ring length." }, "provenance": ["raios-e1000"] },
    { "name": "TDH", "region": "bar0", "offset": 14352, "width": 32, "access": "rw", "semantics": { "status": "source-derived", "description": "Transmit descriptor head." }, "provenance": ["raios-e1000"] },
    { "name": "TDT", "region": "bar0", "offset": 14360, "width": 32, "access": "rw", "semantics": { "status": "source-derived", "description": "Transmit descriptor tail." }, "provenance": ["raios-e1000"] },
    { "name": "MTA", "region": "bar0", "offset": 20992, "width": 32, "access": "rw", "instances": { "count": 128, "stride": 4 }, "semantics": { "status": "source-derived", "description": "Multicast table array; owned source clears 128 entries." }, "provenance": ["raios-e1000"] },
    { "name": "RAL", "region": "bar0", "offset": 21504, "width": 32, "access": "rw", "semantics": { "status": "source-derived", "description": "Receive address low." }, "provenance": ["raios-e1000"] },
    { "name": "RAH", "region": "bar0", "offset": 21508, "width": 32, "access": "rw", "semantics": { "status": "source-derived", "description": "Receive address high; exact field layout is not asserted." }, "provenance": ["raios-e1000"] }
  ]
}
